{
 "authority": {
  "can_decide": false,
  "note": "Step B redundancy/package evidence only. No family is automatically a primary, secondary, backup, incidental or removable combo package."
 },
 "canonical_hash": "lh1:9f7364522bbd760473a9b640b10a3f08ab3c7d786e2e5d011385a4430b399958",
 "deck_id": "Norman_Osborn_Green_Goblin",
 "families": [
  {
   "authority": {
    "can_decide": false,
    "classification_status": "unresolved_requires_judgment",
    "note": "Family synthesis organizes redundancy evidence only; it cannot retain/cut a package or assign final combo priority."
   },
   "burden_signals": {
    "count": 0,
    "low_independent_signal_pieces": [],
    "note": "Structural review signal only; this is not a claim that any piece is literally dead."
   },
   "combo_ids": [
    "1295-3093",
    "742-1295"
   ],
   "evidence": [
    "combo_quality:data/grixis/combo_quality/norman-osborn.json#1295-3093",
    "combo_quality:data/grixis/combo_quality/norman-osborn.json#742-1295",
    "combo_line_semantics:data/grixis/combo_line_semantics/norman-osborn.json#1295-3093",
    "combo_line_semantics:data/grixis/combo_line_semantics/norman-osborn.json#742-1295"
   ],
   "family_id": "norman-osborn:family:001",
   "line_characteristics": {
    "blueprint_win_linked_count": 2,
    "declared_mana_line_count": 2,
    "direct_commander_piece_line_count": 0,
    "direct_endpoint_hint_line_count": 1,
    "endpoint_hints": {
     "mill": 1
    },
    "external_payoff_or_enabler_line_count": 0,
    "infinite_line_count": 0,
    "max_stack_action_proxy": 2,
    "missing_step_semantics_line_count": 0,
    "outcome_hints": {
     "blueprint_designated_win_line": 2
    },
    "power_core_review_line_count": 2,
    "structural_hints": {
     "commander_independent_power_package": 2
    }
   },
   "line_count": 2,
   "pieces": {
    "alternative_or_bridge_pieces": [
     "Demonic Consultation",
     "Tainted Pact"
    ],
    "common_to_every_line": [
     "Thassa's Oracle"
    ],
    "max_piece_count": 2,
    "min_piece_count": 2,
    "union": [
     "Demonic Consultation",
     "Tainted Pact",
     "Thassa's Oracle"
    ]
   },
   "relation": {
    "confidence": "high",
    "evidence_class": "derived_metric",
    "kind": "connected_component_of_near_variant_lines",
    "rule": "edge when two lines share at least min(piece_count)-1 pieces, minimum overlap 1",
    "transitive_component_warning": true
   },
   "review_flags": [
    "commander_independent_power_package_present",
    "direct_damage_life_loss_or_mill_endpoint_hint_present",
    "power_core_review_candidate_present"
   ]
  },
  {
   "authority": {
    "can_decide": false,
    "classification_status": "unresolved_requires_judgment",
    "note": "Family synthesis organizes redundancy evidence only; it cannot retain/cut a package or assign final combo priority."
   },
   "burden_signals": {
    "count": 2,
    "low_independent_signal_pieces": [
     "Brain Freeze",
     "Grinding Station"
    ],
    "note": "Structural review signal only; this is not a claim that any piece is literally dead."
   },
   "combo_ids": [
    "1368-1414-4856",
    "1368-1878-2706",
    "1368-2706-3518",
    "1368-3518-4856",
    "1368-3698--44"
   ],
   "evidence": [
    "combo_quality:data/grixis/combo_quality/norman-osborn.json#1368-1414-4856",
    "combo_quality:data/grixis/combo_quality/norman-osborn.json#1368-1878-2706",
    "combo_quality:data/grixis/combo_quality/norman-osborn.json#1368-2706-3518",
    "combo_quality:data/grixis/combo_quality/norman-osborn.json#1368-3518-4856",
    "combo_quality:data/grixis/combo_quality/norman-osborn.json#1368-3698--44",
    "combo_line_semantics:data/grixis/combo_line_semantics/norman-osborn.json#1368-1414-4856",
    "combo_line_semantics:data/grixis/combo_line_semantics/norman-osborn.json#1368-1878-2706",
    "combo_line_semantics:data/grixis/combo_line_semantics/norman-osborn.json#1368-2706-3518",
    "combo_line_semantics:data/grixis/combo_line_semantics/norman-osborn.json#1368-3518-4856",
    "combo_line_semantics:data/grixis/combo_line_semantics/norman-osborn.json#1368-3698--44"
   ],
   "family_id": "norman-osborn:family:002",
   "line_characteristics": {
    "blueprint_win_linked_count": 5,
    "declared_mana_line_count": 1,
    "direct_commander_piece_line_count": 0,
    "direct_endpoint_hint_line_count": 3,
    "endpoint_hints": {
     "draw": 2,
     "mana": 2,
     "mill": 3,
     "storm": 5
    },
    "external_payoff_or_enabler_line_count": 1,
    "infinite_line_count": 5,
    "max_stack_action_proxy": 5,
    "missing_step_semantics_line_count": 0,
    "outcome_hints": {
     "blueprint_designated_win_line": 4,
     "blueprint_win_requires_external_payoff": 1
    },
    "power_core_review_line_count": 4,
    "structural_hints": {
     "commander_independent_power_package": 4,
     "commander_supported_combo": 1
    }
   },
   "line_count": 5,
   "pieces": {
    "alternative_or_bridge_pieces": [
     "Brain Freeze",
     "Grinding Station",
     "Jeska's Will",
     "Lion's Eye Diamond",
     "Lotus Petal",
     "Wheel of Fortune"
    ],
    "common_to_every_line": [
     "Underworld Breach"
    ],
    "max_piece_count": 3,
    "min_piece_count": 2,
    "union": [
     "Brain Freeze",
     "Grinding Station",
     "Jeska's Will",
     "Lion's Eye Diamond",
     "Lotus Petal",
     "Underworld Breach",
     "Wheel of Fortune"
    ]
   },
   "relation": {
    "confidence": "high",
    "evidence_class": "derived_metric",
    "kind": "connected_component_of_near_variant_lines",
    "rule": "edge when two lines share at least min(piece_count)-1 pieces, minimum overlap 1",
    "transitive_component_warning": true
   },
   "review_flags": [
    "commander_independent_power_package_present",
    "direct_damage_life_loss_or_mill_endpoint_hint_present",
    "external_payoff_or_enabler_present",
    "low_independent_signal_piece_present",
    "power_core_review_candidate_present"
   ]
  }
 ],
 "generated_by": "scripts/grixis_combo_families.py v1",
 "inputs": {
  "combo_line_semantics": "data/grixis/combo_line_semantics/norman-osborn.json",
  "combo_quality": "data/grixis/combo_quality/norman-osborn.json",
  "power_core": "data/grixis/power_core/norman-osborn.json"
 },
 "schema_version": 1,
 "slug": "norman-osborn",
 "status": "provisional_evidence",
 "summary": {
  "commander_independent_family_count": 2,
  "family_count": 2,
  "largest_family_line_count": 5,
  "line_count": 7,
  "multi_line_family_count": 2,
  "power_core_family_count": 2,
  "singleton_family_count": 0
 }
}
