{
 "authority": {
  "can_decide": false,
  "note": "Step B redundancy/package evidence only. No family is automatically a primary, secondary, backup, incidental or removable combo package."
 },
 "canonical_hash": "lh1:04e4d973c9055eda049e943fc333e8642f24a11a20b61c77437127c6cf1b9e95",
 "deck_id": "Dr__Eggman",
 "families": [],
 "generated_by": "scripts/grixis_combo_families.py v1",
 "inputs": {
  "combo_line_semantics": "data/grixis/combo_line_semantics/dr-eggman.json",
  "combo_quality": "data/grixis/combo_quality/dr-eggman.json",
  "power_core": "data/grixis/power_core/dr-eggman.json"
 },
 "schema_version": 1,
 "slug": "dr-eggman",
 "status": "provisional_evidence",
 "summary": {
  "commander_independent_family_count": 0,
  "family_count": 0,
  "largest_family_line_count": 0,
  "line_count": 0,
  "multi_line_family_count": 0,
  "power_core_family_count": 0,
  "singleton_family_count": 0
 }
}
