{
 "authority": {
  "can_decide": false,
  "note": "Step B redundancy/package evidence only. No family is automatically a primary, secondary, backup, incidental or removable combo package."
 },
 "canonical_hash": "lh1:38598ad4616bb80278e5e8e24c313afdc8bcd555312bbac3fca33fe84d6e9e86",
 "deck_id": "Admiral_Beckett_Brass",
 "families": [],
 "generated_by": "scripts/grixis_combo_families.py v1",
 "inputs": {
  "combo_line_semantics": "data/grixis/combo_line_semantics/admiral-beckett-brass.json",
  "combo_quality": "data/grixis/combo_quality/admiral-beckett-brass.json",
  "power_core": "data/grixis/power_core/admiral-beckett-brass.json"
 },
 "schema_version": 1,
 "slug": "admiral-beckett-brass",
 "status": "provisional_evidence",
 "summary": {
  "commander_independent_family_count": 0,
  "family_count": 0,
  "largest_family_line_count": 0,
  "line_count": 0,
  "multi_line_family_count": 0,
  "power_core_family_count": 0,
  "singleton_family_count": 0
 }
}
