{
 "authority": {
  "can_decide": false,
  "note": "Step B redundancy/package evidence only. No family is automatically a primary, secondary, backup, incidental or removable combo package."
 },
 "canonical_hash": "lh1:0cbe60a05298b70d73e20acd46eb164cb081b76da9401c69fbce41cf3b871f09",
 "deck_id": "Crosis__the_Purger",
 "families": [
  {
   "authority": {
    "can_decide": false,
    "classification_status": "unresolved_requires_judgment",
    "note": "Family synthesis organizes redundancy evidence only; it cannot retain/cut a package or assign final combo priority."
   },
   "burden_signals": {
    "count": 0,
    "low_independent_signal_pieces": [],
    "note": "Structural review signal only; this is not a claim that any piece is literally dead."
   },
   "combo_ids": [
    "2286-3221"
   ],
   "evidence": [
    "combo_quality:data/grixis/combo_quality/crosis-the-purger.json#2286-3221",
    "combo_line_semantics:data/grixis/combo_line_semantics/crosis-the-purger.json#2286-3221"
   ],
   "family_id": "crosis-the-purger:family:001",
   "line_characteristics": {
    "blueprint_win_linked_count": 1,
    "declared_mana_line_count": 0,
    "direct_commander_piece_line_count": 0,
    "direct_endpoint_hint_line_count": 1,
    "endpoint_hints": {
     "draw": 1,
     "mill": 1
    },
    "external_payoff_or_enabler_line_count": 0,
    "infinite_line_count": 0,
    "max_stack_action_proxy": 1,
    "missing_step_semantics_line_count": 0,
    "outcome_hints": {
     "blueprint_designated_win_line": 1
    },
    "power_core_review_line_count": 1,
    "structural_hints": {
     "commander_independent_power_package": 1
    }
   },
   "line_count": 1,
   "pieces": {
    "alternative_or_bridge_pieces": [],
    "common_to_every_line": [
     "Notion Thief",
     "Teferi's Puzzle Box"
    ],
    "max_piece_count": 2,
    "min_piece_count": 2,
    "union": [
     "Notion Thief",
     "Teferi's Puzzle Box"
    ]
   },
   "relation": {
    "confidence": "high",
    "evidence_class": "derived_metric",
    "kind": "connected_component_of_near_variant_lines",
    "rule": "edge when two lines share at least min(piece_count)-1 pieces, minimum overlap 1",
    "transitive_component_warning": true
   },
   "review_flags": [
    "commander_independent_power_package_present",
    "direct_damage_life_loss_or_mill_endpoint_hint_present",
    "power_core_review_candidate_present"
   ]
  }
 ],
 "generated_by": "scripts/grixis_combo_families.py v1",
 "inputs": {
  "combo_line_semantics": "data/grixis/combo_line_semantics/crosis-the-purger.json",
  "combo_quality": "data/grixis/combo_quality/crosis-the-purger.json",
  "power_core": "data/grixis/power_core/crosis-the-purger.json"
 },
 "schema_version": 1,
 "slug": "crosis-the-purger",
 "status": "provisional_evidence",
 "summary": {
  "commander_independent_family_count": 1,
  "family_count": 1,
  "largest_family_line_count": 1,
  "line_count": 1,
  "multi_line_family_count": 0,
  "power_core_family_count": 1,
  "singleton_family_count": 1
 }
}
